{
  "decision_id": "ZVK-DEC-2026-000001",
  "candidate_id": "ZVK-CAND-2026-000001",
  "applied_risk_tier": 3,
  "decision": "approved",
  "decided_by": [
    {"reviewer_id": "alice@zovark.io",  "reviewer_role": "maintainer",       "reviewed_at": "2026-09-22T10:00:00Z"},
    {"reviewer_id": "bob@zovark.io",    "reviewer_role": "maintainer",       "reviewed_at": "2026-09-22T11:00:00Z"},
    {"reviewer_id": "carol@zovark.io",  "reviewer_role": "security-officer", "reviewed_at": "2026-09-22T12:00:00Z"}
  ],
  "decided_at": "2026-09-22T12:00:00Z",
  "soak_window_observed": {
    "soak_start": "2026-09-15T12:00:00Z",
    "soak_end": "2026-09-22T12:00:00Z",
    "soak_duration_seconds": 604800
  },
  "evidence": {
    "ci_run_ids": ["gh-actions-12345"],
    "corpus_results": ["wazuh-mapping-corpus:0a1b2c3d:PASS"],
    "security_review_id": "SEC-REV-2026-0007"
  },
  "notes": "Mapping change. 7-day soak observed. 2 maintainers + 1 security-officer reviewed."
}
